{
  "$schema": "./joystick-config.schema.json",
  "ProductName": "WwPap3",
  "USB_VID": "0x4098",
  "USB_PID": "0xBF0F",
  "LightKey": 0,
  "LightKeyName": "N1",
  "Functions": [
    {
      "FunName": "leds",
      "USB_CMD_length": 14,
      "HeaderBytes": [
        "0x02",
        "0x0F",
        "0xBF",
        "0x00",
        "0x00",
        "0x03",
        "0x49",
        "0x00",
        "0x00",
        "0x00",
        "0x00",
        "0x00",
        "0x00",
        "0x00"
      ],
      "FunIndex": 1,
      "LightBytes": [
        "0x02",
        "0x0F",
        "0xBF",
        "0x00",
        "0x00",
        "0x03",
        "0x49",
        "0x00",
        "0xEE",
        "0x00",
        "0x00",
        "0x00",
        "0x00",
        "0x00"
      ],
      "TestBytes": [
        "0x02",
        "0x0F",
        "0xBF",
        "0x00",
        "0x00",
        "0x03",
        "0x49",
        "0xCC",
        "0x01",
        "0x00",
        "0x00",
        "0x00",
        "0x00",
        "0x00"
      ],
      "OffBytes": [
        "0x020FBF0000034900000000000000",
        "0x020FBF0000034901000000000000",
        "0x020FBF0000034902000000000000"
      ],
      "SubFunctions": [
        {
          "ledCmd": "i56:16"
        }
      ],
      "SubIndexFunctions": [
        {
          "Bkl": "0"
        },
        {
          "LcdBkl": "1"
        },
        {
          "LedBkl": "2"
        },
        {
          "N1": "3"
        },
        {
          "Speed": "4"
        },
        {
          "Vnav": "5"
        },
        {
          "LvlChg": "6"
        },
        {
          "HdgSel": "7"
        },
        {
          "Lnav": "8"
        },
        {
          "VorLoc": "9"
        },
        {
          "App": "10"
        },
        {
          "AltHld": "11"
        },
        {
          "Vs": "12"
        },
        {
          "CmdA": "13"
        },
        {
          "CwsA": "14"
        },
        {
          "CmdB": "15"
        },
        {
          "CwsB": "16"
        },
        {
          "AtArm": "17"
        },
        {
          "MaCapt": "18"
        },
        {
          "MaFo": "19"
        },
        {
          "AtSol": "30"
        }
      ]
    },
    {
      "FunName": "config",
      "USB_CMD_length": 14,
      "HeaderBytes": [
        "0x02",
        "0x01",
        "0x00",
        "0x00",
        "0x00",
        "0x04",
        "0x05",
        "0x00",
        "0x00",
        "0x00",
        "0x00",
        "0x00",
        "0x00",
        "0x00"
      ],
      "SubFunctions": [
        {
          "configValue": "i40:24"
        }
      ]
    },
    {
      "FunName": "lcdclear",
      "USB_CMD_length": 64,
      "HeaderBytes": [
        "0xF0",
        "0x02",
        "0x00",
        "0x00"
      ],
      "SubFunctions": [
        {
          "seqNum": "i16:8"
        }
      ]
    },
    {
      "FunName": "init",
      "USB_CMD_length": 64,
      "HeaderBytes": [
        "0xF0",
        "0x00",
        "0x01",
        "0x12",
        "0x0F",
        "0xBF",
        "0x00",
        "0x00",
        "0x04",
        "0x01",
        "0x00",
        "0x00",
        "0x26",
        "0xCC",
        "0x00",
        "0x00",
        "0x00",
        "0x01",
        "0x00",
        "0x00",
        "0x00",
        "0x03",
        "0x00",
        "0x00"
      ],
      "SubFunctions": [
        {
          "seqNum": "i16:8"
        }
      ]
    },
    {
      "FunName": "lcd",
      "USB_CMD_length": 64,
      "HeaderBytes": [
        "0xF0",
        "0x00",
        "0x01",
        "0x38",
        "0x0F",
        "0xBF",
        "0x00",
        "0x00",
        "0x02",
        "0x01",
        "0x00",
        "0x00",
        "0xDF",
        "0xA2",
        "0x50",
        "0x00",
        "0x00",
        "0xB0"
      ],
      "SkipBytes": [
        "0x00",
        "0x00",
        "0x00",
        "0x00",
        "0x00",
        "0x00",
        "0x00",
        "0x00",
        "0x00",
        "0x00",
        "0x00",
        "0x00",
        "0x00",
        "0x00",
        "0x00",
        "0x00",
        "0x00",
        "0x00",
        "0x00",
        "0x00",
        "0x00",
        "0x00",
        "0x00",
        "0x00",
        "0x00",
        "0xFF",
        "0xFF",
        "0xFF",
        "0xFF",
        "0xFF",
        "0xFF",
        "0xFF",
        "0xFF",
        "0xFF",
        "0xFF",
        "0xFF",
        "0xFF",
        "0xFF",
        "0xFF",
        "0xFF",
        "0xFF",
        "0xFF",
        "0xFF",
        "0xFF",
        "0xFF",
        "0xFF",
        "0xFF",
        "0xFF",
        "0xFF",
        "0xFF",
        "0xFF",
        "0xFF",
        "0xFF",
        "0xFF",
        "0xFF",
        "0xFF",
        "0xFF"
      ],
      "SubFunctions": [
        {
          "seqNum": "i16:8",
          "lcd1": "i200:32",
          "lcd2": "i232:32",
          "lcd3": "i264:32",
          "lcd4": "i296:32",
          "lcd5": "i328:32",
          "lcd6": "i360:32",
          "lcd7": "i392:32",
          "lcd8": "i424:32"
        }
      ]
    },
    {
      "FunName": "empty",
      "USB_CMD_length": 64,
      "HeaderBytes": [
        "0xF0",
        "0x00",
        "0x01",
        "0x38"
      ],
      "SubFunctions": [
        {
          "seqNum": "i16:8"
        }
      ]
    },
    {
      "FunName": "finish",
      "USB_CMD_length": 64,
      "HeaderBytes": [
        "0xF0",
        "0x00",
        "0x01",
        "0x2A",
        "0x00",
        "0x00",
        "0x00",
        "0x00",
        "0x00",
        "0x00",
        "0x00",
        "0x00",
        "0x00",
        "0x00",
        "0x00",
        "0x00",
        "0x00",
        "0x00",
        "0x00",
        "0x00",
        "0x00",
        "0x00",
        "0x00",
        "0x00",
        "0x00",
        "0x00",
        "0x00",
        "0x00",
        "0x00",
        "0x0F",
        "0xBF",
        "0x00",
        "0x00",
        "0x03",
        "0x01",
        "0x00",
        "0x00",
        "0xDF",
        "0xA2",
        "0x50"
      ],
      "SubFunctions": [
        {
          "seqNum": "i16:8"
        }
      ]
    }
  ]
}
