{
  "$schema": "./joystick-config.schema.json",
  "ProductName": "WwPdc3mR",
  "USB_VID": "0x4098",
  "USB_PID": "0xBB52",
  "LightKey": 0,
  "LightKeyName": "FPV",
  "Functions": [
    {
      "FunName": "leds",
      "USB_CMD_length": 14,
      "HeaderBytes": [
        "0x02",
        "0x50",
        "0xBB",
        "0x00",
        "0x00",
        "0x03",
        "0x49",
        "0x00",
        "0x00",
        "0x00",
        "0x00",
        "0x00",
        "0x00",
        "0x00"
      ],
      "FunIndex": 1,
      "LightBytes": [
        "0x02",
        "0x50",
        "0xBB",
        "0x00",
        "0x00",
        "0x03",
        "0x49",
        "0x00",
        "0xEE",
        "0x00",
        "0x00",
        "0x00",
        "0x00",
        "0x00"
      ],
      "TestBytes": [
        "0x02",
        "0x50",
        "0xBB",
        "0x00",
        "0x00",
        "0x03",
        "0x49",
        "0x00",
        "0x88",
        "0x00",
        "0x00",
        "0x00",
        "0x00",
        "0x00"
      ],
      "OffBytes": [
        "0x0250BB0000034900000000000000"
      ],
      "SubFunctions": [
        {
          "ledCmd": "i56:16"
        }
      ],
      "SubIndexFunctions": [
        {
          "Bkl": "0"
        }
      ]
    }
  ]
}
