{
  "$schema": "./joystick-config.schema.json",
  "ProductName": "WwUrsa",
  "USB_VID": "0x4098",
  "USB_PID": "0xB920",
  "LightKey": 3,
  "LightKeyName": "FAULT1",
  "Functions": [
    {
      "FunName": "leds",
      "USB_CMD_length": 14,
      "HeaderBytes": [
        "0x02",
        "0x10",
        "0xB9",
        "0x00",
        "0x00",
        "0x03",
        "0x49",
        "0x00",
        "0x00",
        "0x00",
        "0x00",
        "0x00",
        "0x00",
        "0x00"
      ],
      "FunIndex": 1,
      "LightBytes": [
        "0x02",
        "0x10",
        "0xB9",
        "0x00",
        "0x00",
        "0x03",
        "0x49",
        "0x00",
        "0xEE",
        "0x00",
        "0x00",
        "0x00",
        "0x00",
        "0x00"
      ],
      "TestBytes": [
        "0x02",
        "0x10",
        "0xB9",
        "0x00",
        "0x00",
        "0x03",
        "0x49",
        "0xCC",
        "0x88",
        "0x00",
        "0x00",
        "0x00",
        "0x00",
        "0x00"
      ],
      "OffBytes": [
        "0x0210B90000034900000000000000",
        "0x0210B90000034902000000000000",
        "0x0210B90000034903000000000000",
        "0x0210B90000034904000000000000",
        "0x0210B90000034905000000000000",
        "0x0210B90000034906000000000000"
      ],
      "SubFunctions": [
        {
          "ledCmd": "i56:16"
        }
      ],
      "SubIndexFunctions": [
        {
          "Bkl": "0"
        },
        {
          "Maker": "2"
        },
        {
          "Fault1": "3"
        },
        {
          "Fire1": "4"
        },
        {
          "Fault2": "5"
        },
        {
          "Fire2": "6"
        },
        {
          "VibL": "14"
        },
        {
          "VibR": "16"
        }
      ]
    },
    {
      "FunName": "pac",
      "USB_CMD_length": 14,
      "HeaderBytes": [
        "0x02",
        "0x01",
        "0xB9",
        "0x00",
        "0x00",
        "0x03",
        "0x49",
        "0x00",
        "0x00",
        "0x00",
        "0x00",
        "0x00",
        "0x00",
        "0x00"
      ],
      "FunIndex": 1,
      "LightBytes": [
        "0x02",
        "0x01",
        "0xB9",
        "0x00",
        "0x00",
        "0x03",
        "0x49",
        "0x00",
        "0xEE",
        "0x00",
        "0x00",
        "0x00",
        "0x00",
        "0x00"
      ],
      "TestBytes": [
        "0x02",
        "0x01",
        "0xB9",
        "0x00",
        "0x00",
        "0x03",
        "0x49",
        "0x02",
        "0x88",
        "0x00",
        "0x00",
        "0x00",
        "0x00",
        "0x00"
      ],
      "OffBytes": [
        "0x0201B90000034900000000000000",
        "0x0201B90000034902000000000000"
      ],
      "SubFunctions": [
        {
          "ledCmd": "i56:16"
        }
      ],
      "SubIndexFunctions": [
        {
          "Bkl": "0"
        },
        {
          "LcdBkl": "2"
        }
      ]
    },
    {
      "FunName": "lcd",
      "USB_CMD_length": 64,
      "HeaderBytes": [
        "0xF0",
        "0x00",
        "0x01",
        "0x35",
        "0x01",
        "0xB9",
        "0x00",
        "0x00",
        "0x02",
        "0x01",
        "0x00",
        "0x00",
        "0xFF",
        "0xFF",
        "0x00",
        "0x00",
        "0x00",
        "0x24"
      ],
      "SkipBytes": [
        "0x00",
        "0x00",
        "0x00",
        "0x00",
        "0x00",
        "0x00",
        "0x00",
        "0x00",
        "0x00",
        "0x00",
        "0x00",
        "0x00",
        "0x00",
        "0x00",
        "0x00",
        "0x00",
        "0x00",
        "0x00",
        "0x00",
        "0x00",
        "0x00",
        "0x00",
        "0x00",
        "0x00",
        "0x00",
        "0xFF",
        "0xFF",
        "0xFF",
        "0xFF",
        "0xFF",
        "0xFF",
        "0xFF",
        "0xFF",
        "0xFF",
        "0xFF",
        "0xFF",
        "0xFF",
        "0xFF",
        "0xFF",
        "0xFF",
        "0xFF",
        "0xFF",
        "0xFF",
        "0xFF",
        "0xFF",
        "0xFF",
        "0xFF",
        "0xFF",
        "0xFF",
        "0xFF",
        "0xFF",
        "0xFF",
        "0xFF",
        "0xFF",
        "0xFF",
        "0xFF",
        "0xFF"
      ],
      "SubFunctions": [
        {
          "seqNum": "i16:8",
          "lcd1": "i424:32",
          "lcd2": "i392:32",
          "lcd3": "i360:32",
          "lcd4": "i328:32",
          "lcd5": "i296:32",
          "lcd6": "i264:32",
          "lcd7": "i232:32",
          "lcd8": "i200:32",
          "lcd9": "i456:32"
        }
      ]
    },
    {
      "FunName": "finish",
      "USB_CMD_length": 64,
      "HeaderBytes": [
        "0xF0",
        "0x00",
        "0x01",
        "0x11",
        "0x01",
        "0xB9",
        "0x00",
        "0x00",
        "0x03",
        "0x01",
        "0x00",
        "0x00",
        "0xFF",
        "0xFF",
        "0x00",
        "0x00"
      ],
      "SubFunctions": [
        {
          "seqNum": "i16:8"
        }
      ]
    }
  ]
}
