{
  "$schema": "./joystick-config.schema.json",
  "ProductName": "WwEcam",
  "USB_VID": "0x4098",
  "USB_PID": "0xBB70",
  "LightKey": 18,
  "LightKeyName": "STS",
  "Functions": [
    {
      "FunName": "leds",
      "USB_CMD_length": 14,
      "HeaderBytes": [
        "0x02",
        "0x70",
        "0xBB",
        "0x00",
        "0x00",
        "0x03",
        "0x49",
        "0x00",
        "0x00",
        "0x00",
        "0x00",
        "0x00",
        "0x00",
        "0x00"
      ],
      "FunIndex": 1,
      "LightBytes": [
        "0x02",
        "0x70",
        "0xBB",
        "0x00",
        "0x00",
        "0x03",
        "0x49",
        "0x10",
        "0xEE",
        "0x00",
        "0x00",
        "0x00",
        "0x00",
        "0x00"
      ],
      "TestBytes": [
        "0x02",
        "0x70",
        "0xBB",
        "0x00",
        "0x00",
        "0x03",
        "0x49",
        "0xCC",
        "0x88",
        "0x00",
        "0x00",
        "0x00",
        "0x00",
        "0x00"
      ],
      "OffBytes": [
        "0x0270BB0000034900000000000000",
        "0x0270BB0000034901000000000000",
        "0x0270BB0000034903000000000000"
      ],
      "SubFunctions": [
        {
          "ledCmd": "i56:16"
        }
      ]
    }
  ]
}
