{
  "ProductName": "StkRadio",
  "USB_VID": "0x06A3",
  "USB_PID": "0x0D05",
  "Functions": [
    {
      "FunName": "Radios",
      "USB_FEAT_length": 23,
      "HeaderBytes": ["0x00"],
      "FunIndex": 1,
      "TestBytes": ["0x00", "0xFF", "0xD5", "0xFF", "0xFF", "0xF0"],
      "OffBytes": [
        "0x00",
        "0x0F",
        "0x0F",
        "0x0F",
        "0x0F",
        "0x0F",
        "0x0F",
        "0x0F",
        "0x0F",
        "0x0F",
        "0x0F",
        "0x0F",
        "0x0F",
        "0x0F",
        "0x0F",
        "0x0F",
        "0x0F",
        "0x0F",
        "0x0F",
        "0x0F",
        "0x0F",
        "0x0F",
        "0x0F"
      ],
      "SubFunctions": [
        {
          "com1act1": "i8:8",
          "com1act2": "i16:8",
          "com1act3": "i24:8",
          "com1act4": "i32:8",
          "com1act5": "i40:8",
          "com1stb1": "i48:8",
          "com1stb2": "i56:8",
          "com1stb3": "i64:8",
          "com1stb4": "i72:8",
          "com1stb5": "i80:8",
          "com2act1": "i88:8",
          "com2act2": "i96:8",
          "com2act3": "i104:8",
          "com2act4": "i112:8",
          "com2act5": "i120:8",
          "com2stb1": "i128:8",
          "com2stb2": "i136:8",
          "com2stb3": "i144:8",
          "com2stb4": "i152:8",
          "com2stb5": "i160:8"
        }
      ]
    }
  ]
}
