{
  "$schema": "./joystick-config.schema.json",
  "ProductName": "WwFcuEfisL",
  "USB_VID": "0x4098",
  "USB_PID": "0xBC1D",
  "LightKey": 3,
  "LightKeyName": "AP1",
  "Functions": [
    {
      "FunName": "leds",
      "USB_CMD_length": 14,
      "HeaderBytes": [
        "0x02",
        "0x10",
        "0xBB",
        "0x00",
        "0x00",
        "0x03",
        "0x49",
        "0x00",
        "0x00",
        "0x00",
        "0x00",
        "0x00",
        "0x00",
        "0x00"
      ],
      "FunIndex": 1,
      "LightBytes": [
        "0x02",
        "0x10",
        "0xBB",
        "0x00",
        "0x00",
        "0x03",
        "0x49",
        "0x00",
        "0xEE",
        "0x00",
        "0x00",
        "0x00",
        "0x00",
        "0x00"
      ],
      "TestBytes": [
        "0x02",
        "0x10",
        "0xBB",
        "0x00",
        "0x00",
        "0x03",
        "0x49",
        "0x05",
        "0x01",
        "0x00",
        "0x00",
        "0x00",
        "0x00",
        "0x00"
      ],
      "OffBytes": [
        "0x0210BB0000034900000000000000",
        "0x0210BB0000034901000000000000",
        "0x0210BB0000034902000000000000",
        "0x0210BB0000034903000000000000",
        "0x0210BB0000034905000000000000",
        "0x0210BB0000034907000000000000",
        "0x0210BB0000034909000000000000",
        "0x0210BB000003490B000000000000",
        "0x0210BB000003490D000000000000",
        "0x0210BB000003491E000000000000"
      ],
      "SubFunctions": [
        {
          "ledCmd": "i56:16"
        }
      ],
      "SubIndexFunctions": [
        {
          "Bkl": "0"
        },
        {
          "ScrBkl": "1"
        },
        {
          "LedBkl": "2"
        },
        {
          "Loc": "3"
        },
        {
          "Ap1": "5"
        },
        {
          "Ap2": "7"
        },
        {
          "Athr": "9"
        },
        {
          "Exped": "11"
        },
        {
          "Appr": "13"
        },
        {
          "ExpedBkl": "30"
        }
      ]
    },
    {
      "FunName": "ledsL",
      "USB_CMD_length": 14,
      "HeaderBytes": [
        "0x02",
        "0x0D",
        "0xBF",
        "0x00",
        "0x00",
        "0x03",
        "0x49",
        "0x00",
        "0x00",
        "0x00",
        "0x00",
        "0x00",
        "0x00",
        "0x00"
      ],
      "FunIndex": 1,
      "LightBytes": [
        "0x02",
        "0x0D",
        "0xBF",
        "0x00",
        "0x00",
        "0x03",
        "0x49",
        "0x00",
        "0xEE",
        "0x00",
        "0x00",
        "0x00",
        "0x00",
        "0x00"
      ],
      "TestBytes": [
        "0x02",
        "0x0D",
        "0xBF",
        "0x00",
        "0x00",
        "0x03",
        "0x49",
        "0x03",
        "0x01",
        "0x00",
        "0x00",
        "0x00",
        "0x00",
        "0x00"
      ],
      "OffBytes": [
        "0x020DBF0000034900000000000000",
        "0x020DBF0000034901000000000000",
        "0x020DBF0000034902000000000000",
        "0x020DBF0000034903000000000000",
        "0x020DBF0000034904000000000000",
        "0x020DBF0000034905000000000000",
        "0x020DBF0000034906000000000000",
        "0x020DBF0000034907000000000000",
        "0x020DBF0000034908000000000000",
        "0x020DBF0000034909000000000000"
      ],
      "SubFunctions": [
        {
          "ledCmd": "i56:16"
        }
      ],
      "SubIndexFunctions": [
        {
          "Bkl": "0"
        },
        {
          "ScrBkl": "1"
        },
        {
          "LedBkl": "2"
        },
        {
          "Fd": "3"
        },
        {
          "Ls": "4"
        },
        {
          "Cstr": "5"
        },
        {
          "Wpt": "6"
        },
        {
          "Vord": "7"
        },
        {
          "Ndb": "8"
        },
        {
          "Arpt": "9"
        }
      ]
    },
    {
      "FunName": "init",
      "USB_CMD_length": 64,
      "HeaderBytes": [
        "0xF0",
        "0x02"
      ]
    },
    {
      "FunName": "lcd",
      "USB_CMD_length": 64,
      "HeaderBytes": [
        "0xF0",
        "0x00",
        "0x01",
        "0x31",
        "0x10",
        "0xBB",
        "0x00",
        "0x00",
        "0x02",
        "0x01",
        "0x00",
        "0x00",
        "0xFF",
        "0xFF",
        "0x02",
        "0x00",
        "0x00",
        "0x20",
        "0x00",
        "0x00",
        "0x00",
        "0x00",
        "0x00",
        "0x00",
        "0x00"
      ],
      "SkipBytes": [
        "0x00",
        "0x00",
        "0x00",
        "0x00",
        "0x00",
        "0x00",
        "0x00",
        "0x00",
        "0x00",
        "0x00",
        "0x00",
        "0x00",
        "0x00",
        "0x00",
        "0x00",
        "0x00",
        "0x00",
        "0x00",
        "0x00",
        "0x00",
        "0x00",
        "0x00",
        "0x00",
        "0x00",
        "0x00",
        "0xFF",
        "0xFF",
        "0xFF",
        "0xFF",
        "0xFF",
        "0xFF",
        "0xFF",
        "0xFF",
        "0xFF",
        "0xFF",
        "0xFF",
        "0xFF",
        "0xFF",
        "0xFF",
        "0xFF",
        "0xFF",
        "0xFF",
        "0xFF",
        "0xFF",
        "0xFF",
        "0xFF",
        "0xFF",
        "0xFF",
        "0xFF",
        "0xFF",
        "0xFF",
        "0xFF",
        "0xFF",
        "0xFF",
        "0xFF",
        "0xFF",
        "0xFF"
      ],
      "SubFunctions": [
        {
          "seqNum": "i16:8",
          "spd": "i200:24",
          "hdg": "i224:32",
          "alt": "i256:32",
          "altHi": "i288:16",
          "vs": "i304:32"
        }
      ]
    },
    {
      "FunName": "finish",
      "USB_CMD_length": 64,
      "HeaderBytes": [
        "0xF0",
        "0x00",
        "0x01",
        "0x11",
        "0x10",
        "0xBB",
        "0x00",
        "0x00",
        "0x03",
        "0x01",
        "0x00",
        "0x00",
        "0xFF",
        "0xFF",
        "0x02",
        "0x00"
      ],
      "SubFunctions": [
        {
          "seqNum": "i16:8"
        }
      ]
    },
    {
      "FunName": "lcdL",
      "USB_CMD_length": 64,
      "HeaderBytes": [
        "0xF0",
        "0x00",
        "0x01",
        "0x1A",
        "0x0D",
        "0xBF",
        "0x00",
        "0x00",
        "0x02",
        "0x01",
        "0x00",
        "0x00",
        "0xFF",
        "0xFF",
        "0x1D",
        "0x00",
        "0x00",
        "0x09",
        "0x00",
        "0x00",
        "0x00",
        "0x00",
        "0x00",
        "0x00",
        "0x00"
      ],
      "SkipBytes": [
        "0x00",
        "0x00",
        "0x00",
        "0x00",
        "0x00",
        "0x00",
        "0x00",
        "0x00",
        "0x00",
        "0x00",
        "0x00",
        "0x00",
        "0x00",
        "0x00",
        "0x00",
        "0x00",
        "0x00",
        "0x00",
        "0x00",
        "0x00",
        "0x00",
        "0x00",
        "0x00",
        "0x00",
        "0x00",
        "0xFF",
        "0xFF",
        "0xFF",
        "0xFF",
        "0xFF",
        "0xFF",
        "0xFF",
        "0xFF",
        "0xFF",
        "0xFF",
        "0xFF",
        "0xFF",
        "0xFF",
        "0xFF",
        "0xFF",
        "0xFF",
        "0xFF",
        "0xFF",
        "0xFF",
        "0xFF",
        "0xFF",
        "0xFF",
        "0xFF",
        "0xFF",
        "0xFF",
        "0xFF",
        "0xFF",
        "0xFF",
        "0xFF",
        "0xFF",
        "0xFF",
        "0xFF"
      ],
      "SubFunctions": [
        {
          "seqNum": "i16:8",
          "baro": "i200:32",
          "flag": "i232:8"
        }
      ]
    },
    {
      "FunName": "finishL",
      "USB_CMD_length": 64,
      "HeaderBytes": [
        "0xF0",
        "0x00",
        "0x01",
        "0x11",
        "0x0D",
        "0xBF",
        "0x00",
        "0x00",
        "0x03",
        "0x01",
        "0x00",
        "0x00",
        "0x4C",
        "0x0C",
        "0x1D",
        "0x00"
      ],
      "SubFunctions": [
        {
          "seqNum": "i16:8"
        }
      ]
    }
  ]
}
